review,date
We've been using this utility for years - awesome service!,2023-01-27
This Python app simplified my workflow significantly. Highly recommended.,2023-02-12
"Had a few issues at first, but their support team is top-notch!",2023-03-22
A fantastic tool - it has everything you need and more.,2023-04-02
The interface could be a little more user-friendly.,2023-05-23
Been a fan of this app since day one. It just keeps getting better!,2023-06-23
The recent updates really improved the overall experience.,2023-07-09
A decent web app. There's room for improvement though.,2023-08-11
The app is reliable and efficient. I can't imagine my day without it now.,2023-09-27
Encountered some bugs. Hope they fix it soon.,2023-10-24
This web app is a game-changer! I've boosted my productivity.,2023-11-02
The features are great but it took me a while to understand how to use them.,2023-12-16
Love the simplicity and effectiveness of this app.,2023-01-15
"It's an okay tool, but I've used better.",2023-02-21
Fantastic app! It's made my job so much easier.,2023-03-02
"The learning curve is steep, but it's worth it.",2023-04-10
Great concept but needs more work on the execution.,2023-05-14
This app is innovative and has a lot of potentials. Keep it up!,2023-06-24
"It's a solid tool, but there are some minor issues.",2023-07-28
A great app that delivers on its promises. Very impressed.,2023-08-19
I'm blown away by the features and functionality. Incredible app!,2023-09-28
I'm not satisfied with the app's performance. Disappointing.,2023-10-05
The customer support team went above and beyond to help me. Excellent service!,2023-11-08
"The app crashes frequently, making it unreliable for my needs.",2023-12-17
I've recommended this app to all my colleagues. It's a game-changer!,2023-01-24
The user interface is intuitive and well-designed. Easy to navigate.,2023-02-18
I expected more from this app. It didn't meet my expectations.,2023-03-27
The app's performance has improved significantly with the latest update.,2023-04-05
This app has saved me so much time and effort. Highly efficient!,2023-05-24
"There are some minor bugs, but overall, a solid app.",2023-06-25
"I've tried many similar apps, but this one stands out. Impressive!",2023-07-22
The app's user interface could use some improvements. It feels outdated.,2023-08-17
I'm extremely satisfied with the app's performance. Works like a charm!,2023-09-03
The app's documentation is comprehensive and easy to follow.,2023-10-13
I'm disappointed with the lack of updates and new features.,2023-11-19
This app has become an essential part of my workflow. Highly recommended!,2023-12-09
The app is slow and unresponsive at times. Needs optimization.,2023-01-20
I love the clean and modern design of the app. Pleasing to the eye.,2023-02-11
I've encountered several bugs that hindered my productivity.,2023-03-18
This app has become an indispensable tool for me. Great job!,2023-04-20
The app's user interface is cluttered and confusing. Difficult to navigate.,2023-05-23
"I've been using this app for a while now, and it has become an essential part of my daily routine. Highly recommended!",2023-06-19
The customer support team was unresponsive and unhelpful. Disappointing experience.,2023-07-23
This app has revolutionized the way I work. It's efficient and user-friendly.,2023-08-15
"The app's performance is inconsistent. It works well sometimes, but other times it's slow and unresponsive.",2023-09-26
I'm impressed by the frequent updates and new features added to the app. It keeps getting better!,2023-10-04
"I had high hopes for this app, but it failed to meet my expectations. It lacks important features.",2023-11-26
The app's interface is intuitive and easy to navigate. I didn't face any issues while using it.,2023-12-13
This app is a must-have for anyone in the industry. It streamlines processes and saves time.,2023-01-04
I encountered a critical bug that caused data loss. It was a frustrating experience.,2023-02-22
"The app's design is visually appealing, and the user experience is excellent.",2023-03-28
The app's functionality is limited. It needs more features to be truly useful.,2023-04-08
I've had a positive experience using this app. It has improved my productivity significantly.,2023-05-20
"The app crashes frequently, making it unreliable for daily use.",2023-06-25
The app's customer support team was prompt and helpful in resolving my issues. Great service!,2023-07-12
"I've tried many similar apps, but this one stands out with its exceptional performance and features.",2023-08-13
The app's user interface is outdated and not intuitive. It needs a modern redesign.,2023-09-28
I'm extremely satisfied with this app. It has exceeded my expectations in every way.,2023-10-22
"The app's documentation is comprehensive and easy to follow, making it easy to get started.",2023-11-11
The app's performance has been flawless. I haven't experienced any issues or slowdowns.,2023-12-21
